4,"For 2012, household expenditure data were also collected in the three territories. The data are available in table 11-10-0126-01 (formerly CANSIM table 203-0030). However, caution should be used when comparing provincial and territorial data since the collection method was different in the territories."
5,"Expenditures for registration fees for automobiles, vans and trucks and public and private insurance premiums have been combined for the provinces of Manitoba (starting in 2010), Saskatchewan and British Columbia (starting in 2013). In these provinces, it can be difficult to make a clear distinction between registration fees and public and private insurance premiums."
6,"Starting with the 2017 reference year, the Survey of Household Spending (SHS) uses survey weights which take into account population projections from the 2016 Census. Estimates from SHS 2010 to 2016 are based on survey weights which take into account population projections from the 2011 Census."
7,"To ensure data quality, suppression of expenditure estimates is based on the coefficient of variation (CV). Expenditures that have a CV greater than or equal to 35% are suppressed as they are too unreliable to be published."
8,"Starting in 2014, expenditure estimates for provincial health insurance premiums are included with income taxes. These estimates are calculated using information from personal income tax data (T1). Previously, provincial health insurance premiums were included with health care expenditures."
9,"Expenditures for registration fees and licences for recreational vehicles and insurance premiums for recreational vehicles have been combined for Manitoba (starting in 2012). In this province, it can be difficult to make a clear distinction between registration fees and insurance premiums."
10,"Canada-level statistics include the 10 provinces only."
11,"Starting with the 2017 reference year, the Survey of Household Spending is conducted every two years."
12,"Starting in 2019, expenditures for gifts for non-household members are included in amounts reported for clothing, footwear, accessories and jewellery."
13,"Starting in 2019, expenditures for annuity contracts and transfers to Registered Retirement Income Funds (RRIFs) are included with service charges for banks and other financial institutions."
14,"The 2019 Survey of Household Spending questionnaire was streamlined to reduce respondent burden. As a result, some data series are no longer available or have been combined to create new series starting with reference year 2019. As well, estimates for some expenditure categories in 2019 may no longer be directly comparable to those from previous years due to changes to the questionnaire and/or to the mode used to collect certain expenditures. Additional information on the impact of these changes is available upon request."
15,"The estimate for the 2019 reference year may no longer be directly comparable to those from previous years due to changes in the way the data were collected."

"Correction ID","Correction Date","Correction Note"
"1000","2017-11-09","<p>On November 9, 2017, the data from 2014 were corrected for the series "Makeup, skin care, manicure and fragrance products". As a result, the data for the series "Personal care products", "Personal care", "Total current consumption" and "Total expenditure" may have also changed.<br></p>",

